アトラクション,north,east
パークエントランス,35.6266,139.8898
ヴェネツィアン・ゴンドラ,35.6266,139.8898
ソアリン:&thinsp;ファンタスティック・フライト,35.62749906,139.885751
ディズニーシー・トランジットスチーマーライン,35.626574,139.8859631
フォートレス・エクスプロージョン,35.6266,139.8898
タートル・トーク,35.62337846,139.8872101
タワー・オブ・テラー,35.6239,139.8883
ディズニーシー・エレクトリックレールウェイ,35.62486975,139.8878002
ディズニーシー・トランジットスチーマーライン,35.626574,139.8859631
トイ・ストーリー・マニア！,35.6245,139.8891
ビッグシティ・ヴィークル,35.6266,139.8898
アクアトピア,35.62470841,139.8833209
ディズニーシー・エレクトリックレールウェイ,35.62486975,139.8878002
ニモ＆フレンズ・シーライダー,35.6249,139.8825
インディー・ジョーンズ・アドベンチャー:&thinsp;クリスタルスカルの魔宮,35.6263,139.8809
ディズニーシー・トランジットスチーマーライン,35.626574,139.8859631
レイジング・スピリッツ,35.6227,139.8808
キャラバンカルーセル,35.6266,139.8898
ジャスミンのフライングカーペット,35.6266,139.8898
シンドバッド・ストリーブック・ヴォヤッジ,35.6266,139.8898
マジックランプシアター,35.6284,139.883
アリエルのプレイグラウンド,35.6266,139.8898
ジャンピン・ジェリーフィッシュ,35.6266,139.8898
スカットルのスクーター,35.6266,139.8898
フランダーのフライングフィッシュコースター,35.6266,139.8898
ブローフィッシュ・バルーンレース,35.6266,139.8898
マーメイドラグーンシアター,35.6266,139.8898
ワールプール,35.6266,139.8898
海底2万マイル,35.6264,139.8846
センター・オブ・ジ・アース,35.6259,139.8841
